{
  "$schema": "../../schemas/mcp-registry.schema.json",
  "name": "playwright",
  "version": "1.0.0",
  "title": "Playwright",
  "description": "Browser automation and web scraping using Playwright's accessibility tree.",
  "category": "development",
  "source": "official",
  "tags": ["browser", "automation", "playwright", "scraping", "testing"],
  "icon": "/registry-logos/playwright.svg",
  "color": "#2EAD33",
  "about": "## Playwright MCP\n\nA Model Context Protocol (MCP) server that provides browser automation capabilities using Playwright. This server enables LLMs to interact with web pages through structured accessibility snapshots, bypassing the need for screenshots or visually-tuned models.\n\n### Key Features\n\n- **Fast and lightweight** - Uses Playwright's accessibility tree, not pixel-based input.\n- **LLM-friendly** - No vision models needed, operates purely on structured data.\n- **Deterministic** - Avoids ambiguity common with screenshot-based approaches.\n\n### Getting Started\n\n1. Add this tool: `scooter_add(\"playwright\")`\n2. The server will use `npx @playwright/mcp@latest` to run.\n3. You can now use tools like `browser_navigate`, `browser_click`, and `browser_snapshot` to interact with the web.",
  "homepage": "https://playwright.dev",
  "repository": "https://github.com/microsoft/playwright-mcp",
  "documentation": "https://github.com/microsoft/playwright-mcp#readme",
  "authorization": {
    "type": "none"
  },
  "tools": [
    {
      "name": "browser_navigate",
      "title": "Navigate to URL",
      "description": "Navigate the browser to a specific URL.",
      "inputSchema": {
        "type": "object",
        "properties": {
          "url": {
            "type": "string",
            "description": "The URL to navigate to"
          }
        },
        "required": ["url"]
      },
      "annotations": {
        "readOnlyHint": false,
        "openWorldHint": true
      }
    },
    {
      "name": "browser_snapshot",
      "title": "Page Snapshot",
      "description": "Capture an accessibility snapshot of the current page. This is better than a screenshot for LLMs.",
      "inputSchema": {
        "type": "object",
        "properties": {
          "filename": {
            "type": "string",
            "description": "Optional filename to save the snapshot to markdown instead of returning it."
          }
        }
      },
      "annotations": {
        "readOnlyHint": true
      }
    },
    {
      "name": "browser_click",
      "title": "Click Element",
      "description": "Perform a click on a web page element using its reference from a snapshot.",
      "inputSchema": {
        "type": "object",
        "properties": {
          "ref": {
            "type": "string",
            "description": "Exact target element reference from the page snapshot"
          },
          "element": {
            "type": "string",
            "description": "Human-readable element description (optional)"
          },
          "doubleClick": {
            "type": "boolean",
            "description": "Whether to perform a double click"
          }
        },
        "required": ["ref"]
      },
      "annotations": {
        "readOnlyHint": false
      }
    },
    {
      "name": "browser_type",
      "title": "Type Text",
      "description": "Type text into an editable element.",
      "inputSchema": {
        "type": "object",
        "properties": {
          "ref": {
            "type": "string",
            "description": "Exact target element reference from the page snapshot"
          },
          "text": {
            "type": "string",
            "description": "Text to type into the element"
          },
          "submit": {
            "type": "boolean",
            "description": "Whether to press Enter after typing"
          }
        },
        "required": ["ref", "text"]
      },
      "annotations": {
        "readOnlyHint": false
      }
    },
    {
      "name": "browser_tabs",
      "title": "Manage Tabs",
      "description": "List, create, close, or select a browser tab.",
      "inputSchema": {
        "type": "object",
        "properties": {
          "action": {
            "type": "string",
            "enum": ["list", "create", "close", "select"],
            "description": "Operation to perform"
          },
          "index": {
            "type": "number",
            "description": "Tab index for close/select"
          }
        },
        "required": ["action"]
      },
      "annotations": {
        "readOnlyHint": false
      }
    }
  ],
  "package": {
    "type": "npm",
    "name": "@playwright/mcp",
    "version": "latest"
  },
  "runtime": {
    "transport": "stdio",
    "command": "npx",
    "args": ["-y", "@playwright/mcp@latest"]
  },
  "metadata": {
    "author": "Microsoft",
    "license": "Apache-2.0"
  }
}
